문제,보기1,보기2,보기3,보기4,정답,해설
"반정규화(Denormalization) 유형 중 중복 테이블을 추가하는 방법에 해당하지 않는 것은?","빌드 테이블의 추가","집계 테이블의 추가","진행 테이블의 추가","특정 부분만을 포함하는 테이블 추가",①,"반정규화에서 중복 테이블을 추가하는 방법에는 집계 테이블의 추가, 진행 테이블의 추가, 특정 부분만을 포함하는 테이블의 추가가 있습니다."
"외계인 코드(Alien Code)에 대한 설명으로 옳은 것은?","프로그램의 로직이 복잡하여 이해하기 어려운 프로그램을 의미한다.","아주 오래되거나 참고문서 또는 개발자가 없어 유지보수 작업이 어려운 프로그램을 의미한다.","오류가 없어 디버깅 과정이 필요 없는 프로그램을 의미한다.","사용자가 직접 작성한 프로그램을 의미한다.",②,"아주 오래되거나 참고문서 또는 개발자가 없어 유지보수 작업이 어려운 프로그램을 외계인 코드라고 합니다 (Alien Code)."
"디지털 저작권 관리(DRM)의 기술 요소가 아닌 것은?","크랙 방지 기술","정책 관리 기술","암호화 기술","방화벽 기술",④,"방화벽 기술은 디지털 저작권 관리 기술이 아니고 기업이나 조직 내부의 네트워크와 인터넷 간에 전송되는 정보를 선별하여 수용, 거부, 수정하는 기능을 가진 침입 차단 시스템입니다."
"다음 트리의 차수(Degree)와 단말 노드(Terminal Node)의 수는?","차수 : 4, 단말 노드 : 4","차수 : 2, 단말 노드 : 4","차수 : 4, 단말 노드 : 8","차수 : 2, 단말 노드 : 8",②,"트리의 차수는 가장 차수가 많은 노드의 차수를 의미합니다. 문제에 주어진 트리에서 각 노드의 차수는 A=2, B=1, C=2, E=2이므로 A, C, E 노드의 차수인 2가 트리의 차수입니다. 단말 노드는 자식이 하나도 없는 노드를 의미합니다. 제시된 그림에서 자식이 없는 단말 노드는 D, F, G, H로 총 4개입니다."
"물리데이터 저장소의 파티션 설계에서 파티션 유형으로 옳지 않은 것은?","범위 분할(Range Partitioning)","해시 분할(Hash Partitioning)","조합 분할(Composite Partitioning)","유닛 분할(Unit Partitioning)",④,"파티션의 종류에는 범위 분할, 해시 분할, 조합 분할, 목록 분할, 라운드 로빈 분할이 있습니다."
"형상 관리 도구의 주요 기능으로 거리가 먼 것은?","정규화(Normalization)","체크인(Check-in)","체크아웃(Check-out)","커밋(commit)",①,"정규화는 테이블의 속성들이 상호 종속적인 관계를 갖는 특성을 이용하여 테이블을 무손실 분해하는 과정으로 형상 관리 도구와는 관계가 없습니다."
"패키지 소프트웨어의 일반적인 제품 품질 요구사항 및 테스트를 위한 국제 표준은?","ISO/IEC 2196","IEEE 19554","ISO/IEC 12119","ISO/IEC 14959",③,"소프트웨어 품질과 관련된 표준에는 ISO/IEC 9126, ISO/IEC 12119, ISO/IEC 14598, ISO/IEC 25010이 있습니다."
"블랙박스 테스트 기법으로 거리가 먼 것은?","기초 경로 검사","동치 클래스 분해","경계값 분석","원인 결과 그래프",①,"기초 경로 검사는 화이트박스 테스트 기법에 해당합니다."
"인터페이스 구현 검증 도구가 아닌 것은?","ESB","xUnit","STAF","NTAF",①,"ESB는 애플리케이션 간 연계, 데이터 변환, 웹 서비스 지원 등 표준 기반의 인터페이스를 제공하는 솔루션입니다."
"다음 Postfix 연산식에 대한 연산결과로 옳은 것은? 3 4 * 5 6 * ＋","35","42","77","360",②,"후위 표기 방식 연산식은 연산자가 해당 피연산자 두 개의 오른쪽에 놓인 것을 말합니다. 피연산자 개와 연산자를 묶은 후 연산자를 피연산자 사이에 옮겨 놓고 계산하면 됩니다. ( (3 4 *) (5 6 *) + ) → ( (3 * 4 ) + (5 * 6 ) ) = 12 + 30 = 42"
"테스트 케이스에 일반적으로 포함되는 항목이 아닌 것은?","테스트 조건","테스트 데이터","테스트 비용","예상 결과",③,"테스트 케이스에는 비용에 대한 항목이 포함되지 않습니다."
"이진 검색 알고리즘에 대한 설명으로 틀린 것은?","탐색 효율이 좋고 탐색 시간이 적게 소요된다.","검색할 데이터가 정렬되어 있어야 한다.","피보나치 수열에 따라 다음에 비교할 대상을 선정하여 검색한다.","비교횟수를 거듭할 때마다 검색 대상이 되는 데이터의 수가 절반으로 줄어든다.",③,"이진 검색과 피보나치 수열은 아무런 관계가 없습니다."
"여러 개의 선택 항목 중 하나의 선택만 가능한 경우 사용하는 사용자 인터페이스(UI) 요소는?","텍스트 박스","체크 박스","토글 버튼","라디오 버튼",④,"여러 항목 중 하나만 선택할 수 있는 UI 요소는 라디오 버튼입니다. 체크 박스(Check Box): 여러 개의 선택 상황에서 1개 이상의 값을 선택할 수 있는 버튼, 텍스트 박스(Text Box): 사용자가 데이터를 입력하고 수정할 수 있는 상자"
"다음 중 스택을 이용한 연산과 거리가 먼 것은?","선택 정렬","재귀 호출","후위 표현의 연산(Post-Fix Expression)","깊이 우선 탐색",①,"스택(Stack)은 재귀 호출, 후위 표기법(Postfix), 깊이 우선 탐색과 같이 왔던 길을 되돌아가는 경우에 사용됩니다."
"소프트웨어 테스트와 관련한 설명으로 틀린 것은?","화이트박스 테스트는 모듈의 논리적인 구조를 체계적으로 점검할 수 있다.","블랙박스 테스트는 프로그램의 구조를 고려하지 않는다.","테스트 케이스에는 일반적으로 시험 조건, 테스트 데이터, 예상 결과가 포함되어야 한다.","화이트박스 테스트에서 기본 경로란 흐름 그래프의 시작 노드에서 종료 노드까지의 서로 독립된 경로로 싸이클을 허용하지 않는 경로를 말한다.",③,"루프 내 문장의 수행 여부는 화이트박스 테스트를 통해서만 확인할 수 있습니다."
"애플리케이션의 처리량, 응답 시간, 경과 시간, 자원 사용률에 대해 가상의 사용자를 생성하고 테스트를 수행함으로써 성능 목표를 달성하였는지를 확인하는 테스트 자동화 도구는?","명세 기반 테스트 설계 도구","코드 기반 테스트 설계 도구","기능 테스트 수행 도구","성능 테스트 도구",④,"문제의 내용은 성능 테스트 도구에 대한 설명입니다."
"소스 코드 정적 분석(Static Analysis)에 대한 설명으로 틀린 것은?","소스 코드를 실행시키지 않고 분석한다.","코드에 있는 오류나 잠재적인 오류를 찾아내기 위한 활동이다.","하드웨어적인 방법으로만 코드 분석이 가능하다.","자료 흐름이나 논리 흐름을 분석하여 비정상적인 패턴을 찾을 수 있다.",③,"소스 코드 정적 분석 도구 중 pmd, cppcheck 등은 소프트웨어적인 방법으로 코드를 분석합니다."
"형상 관리의 개념과 절차에 대한 설명으로 틀린 것은?","형상 식별은 형상 관리 계획을 근거로 형상 관리의 대상이 무엇인지 식별하는 과정이다.","형상 관리를 통해 가시성과 추적성을 보장함으로써 소프트웨어의 생산성과 품질을 높일 수 있다.","형상 통제 과정에서는 형상 목록의 변경 요구를 즉시 수용 및 반영해야 한다.","형상 감사는 형상 관리 계획대로 형상 관리가 진행되고 있는지, 형상 항목의 변경이 요구사항에 맞도록 제대로 이뤄졌는지 등을 살펴보는 활동이다.",③,"형상 통제 과정은 식별된 형상 항목에 대한 변경 요구를 검토하여 현재의 기준선(Base Line)이 잘 반영될 수 있도록 조정하는 작업입니다."
"다음 그래프에서 정점 A를 선택하여 깊이 우선 탐색(DFS)으로 운행한 결과는?","ABECDFG","ABECFDG","ABCDEFG","ABEFGCD",④,"깊이 우선 탐색(DFS)은 정점에서 자식 노드 방향으로 운행하면서 형제 노드와 자식 노드가 있을 때 자식 노드를 우선 탐색하는 기법입니다. ... A → B → E → F → G → C → D"
"분할 정복(Divide and Conquer)에 기반한 알고리즘으로 피봇(pivot)을 사용하며 최악의 경우 n(n-1)/2회의 비교를 수행해야 하는 정렬(Sort)은?","Selection Sort","Bubble Sort","Insert Sort","Quick Sort",④,"분할 정복(Divide and Conquer)에 기반한 알고리즘으로 피봇을 사용하는 정렬은 퀵 정렬(Quick Sort)입니다."
